{
  "schemaVersion": "v0.1",
  "packetStatus": "validated-example",
  "complianceManifest": {
    "id": "compliance-as-code/audit-readiness-v1",
    "title": "Audit readiness evidence packet",
    "version": 1,
    "scope": "agent-repo-delivery"
  },
  "authority": {
    "owner": "compliance-as-code",
    "canActOnBehalfOf": ["compliance_owner"]
  },
  "controls": [
    {
      "id": "audit-log-retention",
      "name": "Audit log retention",
      "controlType": "process",
      "status": "required",
      "evidenceRequired": true,
      "evidence": ["observability/log-retention-policy.md"]
    }
  ],
  "obligationPolicy": {
    "enabled": true,
    "maxAgeDays": 60,
    "reviewIntervalDays": 20,
    "governedBy": "compliance-owner"
  },
  "receiptRequirements": {
    "source": "source-receipt.v0.1",
    "control": "control-receipt.v0.1",
    "evidence": "evidence-receipt.v0.1",
    "review": "review-receipt.v0.1",
    "exception": "exception-receipt.v0.1",
    "finalState": "final-state-receipt.v0.1"
  }
}
